url,old,new
https://nmgtechnologies.com/,"IT Outsource Software, Web & Mobile App Development Company - NMG",Transforming Businesses with AI-Driven Innovation. | NMG Tec
https://nmgtechnologies.com/agentic-ai,Agentic AI Consulting Services | Expert AI Development & Integration,"Agentic AI: Beyond Automation, Into Autonomy | NMG Technolog"
https://nmgtechnologies.com/ai-driven-enterprise-software-development,Enterprise AI Solutions | AI Software and Development Company,AI-Driven Enterprise Software Development | NMG Technologies
https://nmgtechnologies.com/ai-enhanced-web-mobile-application-development,AI App Development Services | Custom Artificial Intelligence Applications,AI-Enhanced Web & Mobile Application Development | NMG Techn
https://nmgtechnologies.com/ai-optimized-ecommerce-solutions,AI-Powered Ecommerce | Advanced AI Solutions for Online Retail,AI-Optimized eCommerce Solutions | NMG Technologies
https://nmgtechnologies.com/ai-powered-business-process-transformation,AI Powered Service | Innovative AI-Driven Solutions for Business,AI-Powered Business Process Transformation | NMG Technologie
https://nmgtechnologies.com/blog/advantages-of-asp-net-core,.NET Core: 20 Advantages of Building Your Software in ASP.NET Core |,.NET Core: 20 Advantages of Building Your Software in A | NM
https://nmgtechnologies.com/blog/best-practices-offshore-software-development,Best Practices of Offshore Software Development Company (2022),Best Practices of Offshore Software Development | NMG Techno
https://nmgtechnologies.com/blog/how-to-build-an-app-like-uber,How To Build an App like Uber - Mobile App Development | NMG,Want to build an app like Uber? Read more for exact est | NM
https://nmgtechnologies.com/blog/nmg-technologies-made-list-top-mobile-app-development-companies-goodfirms,NMG Made It on the List of Top Mobile App Development Companies at GoodFirms,NMG Technologies Made It on the List of Top Mobile App  | NM
https://nmgtechnologies.com/blog/nmg-technologies-participated-in-softwave-2023-the-republic-of-korea-software-exhibition,"NMG Technologies Participated in Softwave 2023, The Republic of Korea Software Exhibition","NMG Technologies Participated in Softwave 2023, The Rep | NM"
https://nmgtechnologies.com/blog/nmg-technologies-to-participate-in-leap-2023-tech-conference-in-riyadh-saudi-arabia,"NMG Technologies to Participate in LEAP 2023 Tech Conference in Riyadh, Saudi Arabia",NMG Technologies to Participate in LEAP 2023 Tech Confe | NM
https://nmgtechnologies.com/blog/nmg-technologies-to-participate-in-mobile-word-capital-barcelona-the-worlds-largest-and-most-influential-connectivity-event,NMG Technologies to Participate in Mobile Word Capital Barcelona – the world’s largest and most influential connectivity event,NMG Technologies to Participate in Mobile Word Capital  | NM
https://nmgtechnologies.com/blog/nmg-technologies-to-participate-in-retail-innovation-conference-and-expo-2023-in-chicago,NMG Technologies to Participate in Retail Innovation Conference and Expo 2023 in Chicago,NMG Technologies to Participate in Retail Innovation Co | NM
https://nmgtechnologies.com/blog/nmg-technologies-to-sponsor-and-exhibit-at-brighton-seo-2023-and-online-pr-show-2023,NMG Technologies to Sponsor and Exhibit at Brighton SEO 2023 and Online PR Show 2023,NMG Technologies to Sponsor and Exhibit at Brighton SEO | NM
https://nmgtechnologies.com/blog/nmg-to-participate-in-the-largest-tech-expo-in-the-middle-east-gitex-global-2022-dubai,"NMG to Participate in the Largest Tech Expo in the Middle East - GITEX Global 2022, Dubai",NMG to Participate in the Largest Tech Expo in the Midd | NM
https://nmgtechnologies.com/blog/nmg-to-participate-in-the-largest-tech-expo-in-the-middle-east-gitex-global-2023-dubai,"NMG to Participate in the Largest Tech Expo in the Middle East - GITEX Global 2023, Dubai",NMG to Participate in the Largest Tech Expo in the Midd | NM
https://nmgtechnologies.com/blog/sempo-hangouts-session-user-experience,15 Best Things About Web Design & User Experience in 2019 | NMG,SEMPO Hangouts Session- Web Design and User Experience | NMG
https://nmgtechnologies.com/blog/top-wordpress-themes,Top 15 WordPress Theme for Your Business in 2019 | NMG Technologies,Top WordPress Themes For Your Business | NMG Technologies
https://nmgtechnologies.com/blog/ui-ux-mobile-app-development,Importance of UI & UX in mobile app development in 2022 | NMG,Importance of Effective UI/UX in Mobile App Development | NM
https://nmgtechnologies.com/blog,Blog,Make Your Software Development Journey Easy! | NMG Technolog
https://nmgtechnologies.com/blog/author/nishtha,Blog | Nishtha,Make Your Software Development Journey Easy! | NMG Technolog
https://nmgtechnologies.com/blog/tag/design,Blog | Design,Make Your Software Development Journey Easy! | NMG Technolog
https://nmgtechnologies.com/blog/tag/events,Blog | Events,Make Your Software Development Journey Easy! | NMG Technolog
https://nmgtechnologies.com/blog/tag/events/page/2,Blog | Events (2),Make Your Software Development Journey Easy! | NMG Technolog
https://nmgtechnologies.com/blog/tag/featured,Blog | Featured,Make Your Software Development Journey Easy! | NMG Technolog
https://nmgtechnologies.com/blog/tag/growth,Blog | Growth,Make Your Software Development Journey Easy! | NMG Technolog
https://nmgtechnologies.com/blog/tag/marketing,Blog | Marketing,Make Your Software Development Journey Easy! | NMG Technolog
https://nmgtechnologies.com/blog/tag/mobile,Blog | Mobile,Make Your Software Development Journey Easy! | NMG Technolog
https://nmgtechnologies.com/blog/tag/outsourcing,Blog | Outsourcing,Make Your Software Development Journey Easy! | NMG Technolog
https://nmgtechnologies.com/blog/tag/technology,Blog | Technology,Make Your Software Development Journey Easy! | NMG Technolog
https://nmgtechnologies.com/blog/tag/web,Blog | Web,Make Your Software Development Journey Easy! | NMG Technolog
https://nmgtechnologies.com/contact-us,Contact Us - NMG Technologies,Contact Us | NMG Technologies
https://nmgtechnologies.com/disclaimer,Website Disclaimer,Disclaimer | NMG Technologies
https://nmgtechnologies.com/services/crm-development,CRM Development Services,CRM Development Services | NMG Technologies
https://nmgtechnologies.com/services/dedicated-team-setups/,Dedicated Team Setups,Dedicated Team Setups | NMG Technologies
https://nmgtechnologies.com/services/erp-development,ERP Development,ERP Software Development Service | NMG Technologies
https://nmgtechnologies.com/services/shopify,Shopify Development,Shopify Development Service | NMG Technologies
https://nmgtechnologies.com/services/web-development,Web Development,Web Development Service | NMG Technologies
https://nmgtechnologies.com/sitemap,Sitemap - NMG Technologies,Sitemap | NMG Technologies
